{
  "approved_at": "2026-07-21T10:59:48Z",
  "backend": {
    "implementation": "AUTOMATIC1111",
    "local": true,
    "type": "webui"
  },
  "briefs_sha256": "ad4c09e44b959061c297e3b8f27ca4a110a8836d77b628e621587d48b5c1900c",
  "copyright_holder": "Capricorn",
  "installation_or_download": {
    "approved": false,
    "items": []
  },
  "models": [
    {
      "download_approved": false,
      "expected_storage": "existing local AUTOMATIC1111 checkpoint directory",
      "id": "civitai/anything-v5@30163",
      "license_id": "Civitai model permissions for model 9409",
      "license_url": "https://civitai.com/models/9409?modelVersionId=30163",
      "output_redistribution_status": "approved",
      "sha256": "7f96a1a9ca9b3a3242a9ae95d19284f0d2da8d5282b42d2d974398bf7663a252",
      "source": "https://civitai.com/models/9409?modelVersionId=30163",
      "use_approved": true
    }
  ],
  "repository_license": "MIT",
  "schema_version": 1,
  "status": "approved"
}
